{
  "$schema": "https://json-schema.org/draft/2020-12/schema",
  "$id": "https://github.com/CGG888/SrcBox/blob/main/voice/schema/voice-pack.schema.json",
  "title": "SrcBox voice vocabulary pack",
  "description": "The words a spoken sentence is read with. A pack replaces every section it carries and leaves the sections it omits to the built-in tables, so a pack may be a whole vocabulary or a small correction.",
  "type": "object",
  "required": ["schema", "lang", "version"],
  "additionalProperties": false,
  "properties": {
    "schema": {
      "const": 1,
      "description": "Format version. The app refuses a pack that names another one."
    },
    "lang": {
      "type": "string",
      "minLength": 2,
      "maxLength": 16,
      "description": "The language this vocabulary is written for, for example zh-CN."
    },
    "version": {
      "type": "string",
      "minLength": 1,
      "maxLength": 32,
      "description": "Compared as dotted numbers against the built-in version to decide whether an update is worth offering."
    },
    "updated": {
      "type": "string",
      "maxLength": 32,
      "description": "Free text, shown in the settings window."
    },
    "notes": {
      "type": "string",
      "maxLength": 500,
      "description": "Free text, shown in the settings window."
    },
    "phrases": {
      "type": "array",
      "maxItems": 500,
      "description": "Tested in this order; the first match wins, so a narrow phrasing has to come before a broad one.",
      "items": { "$ref": "#/$defs/phrase" }
    },
    "prepositions": {
      "type": "array",
      "maxItems": 500,
      "description": "Filler between the verb and its target.",
      "items": { "$ref": "#/$defs/word" }
    },
    "noiseWords": {
      "type": "array",
      "maxItems": 500,
      "description": "Words dropped before the rest of a sentence is treated as a channel or programme name.",
      "items": { "$ref": "#/$defs/word" }
    },
    "timeWords": { "$ref": "#/$defs/timeWords" },
    "hotwords": {
      "type": "array",
      "maxItems": 500,
      "description": "Channel and programme names the recogniser should be biased towards. Only recognisers that support a word list use them.",
      "items": { "$ref": "#/$defs/word" }
    }
  },
  "$defs": {
    "word": { "type": "string", "minLength": 1, "maxLength": 32 },
    "phrase": {
      "type": "object",
      "required": ["name", "verb", "pattern"],
      "additionalProperties": false,
      "properties": {
        "name": {
          "type": "string",
          "minLength": 1,
          "maxLength": 64,
          "description": "Unique within a pack; reported back as the rule that matched."
        },
        "verb": {
          "type": "string",
          "description": "What the phrasing means.",
          "enum": [
            "SwitchChannel",
            "ChannelStep",
            "SwitchStream",
            "LoadPlaylist",
            "Play",
            "Pause",
            "Stop",
            "ToggleMute",
            "VolumeSet",
            "VolumeStep",
            "Fullscreen",
            "Exit",
            "Seek",
            "EpgNow",
            "EpgReplay"
          ]
        },
        "pattern": {
          "type": "string",
          "minLength": 1,
          "maxLength": 500,
          "description": "A .NET regular expression, matched against the sentence with the punctuation and the spaces removed. It is compiled with a 50 ms timeout."
        },
        "numberGroup": {
          "type": "string",
          "description": "Name of the group holding a number to read, such as num."
        },
        "relativeGroup": {
          "type": "string",
          "description": "Name of the group holding a relative change, such as louder or quieter."
        },
        "arg": {
          "type": "string",
          "description": "Fixed argument for a phrasing that carries none, such as -1 for the next channel."
        }
      }
    },
    "part": {
      "type": "object",
      "required": ["words", "from", "to"],
      "additionalProperties": false,
      "properties": {
        "words": { "type": "array", "minItems": 1, "maxItems": 64, "items": { "$ref": "#/$defs/word" } },
        "from": { "type": "integer", "minimum": 0, "maximum": 24 },
        "to": { "type": "integer", "minimum": 0, "maximum": 24 },
        "label": { "type": "string", "maxLength": 32 }
      }
    },
    "weekday": {
      "type": "object",
      "required": ["words", "day"],
      "additionalProperties": false,
      "properties": {
        "words": { "type": "array", "minItems": 1, "maxItems": 64, "items": { "$ref": "#/$defs/word" } },
        "day": {
          "type": "integer",
          "minimum": 0,
          "maximum": 6,
          "description": "0 is Sunday, matching System.DayOfWeek."
        }
      }
    },
    "timeWords": {
      "type": "object",
      "additionalProperties": false,
      "description": "Every list is optional; a list that is left out keeps the built-in words.",
      "properties": {
        "day": { "type": "array", "maxItems": 500, "description": "today, yesterday, the day before ...", "items": { "$ref": "#/$defs/word" } },
        "thisWeek": { "type": "array", "maxItems": 500, "items": { "$ref": "#/$defs/word" } },
        "lastWeek": { "type": "array", "maxItems": 500, "items": { "$ref": "#/$defs/word" } },
        "justNow": { "type": "array", "maxItems": 500, "items": { "$ref": "#/$defs/word" } },
        "parts": {
          "type": "array",
          "maxItems": 64,
          "description": "Order is precedence: the first part whose word appears wins, so 凌晨 has to come before 早上.",
          "items": { "$ref": "#/$defs/part" }
        },
        "weekdays": { "type": "array", "maxItems": 14, "items": { "$ref": "#/$defs/weekday" } }
      }
    }
  }
}
